postId,tweet
3757,WHO FUCKING WITH ME TONIGHT & TOMORROW!?!!! BIRTHDAY IS HERE LIL' BX!:stuck_out_tongue_closed_eyes::stuck_out_tongue_closed_eyes::stuck_out_tongue_closed_eyes::stuck_out_tongue_closed_eyes::stuck_out_tongue_closed_eyes:
1938,"That low IQ niggur, instant punishment, it makes me happy to see him down and fucked up"
2094,Our economy is in the fucking dark and all black people care about is black lives matter
1435,"it must be pretty damning to racially mock people who are the same race as you. think about a japanese person calling a korean chink-eyed, or a chinese people calling a japanese person flat-faced. how fucking retarded would it be? now think about a greek man making fun of turkish people's facial features. or a italian man making fun of spainairds for being dark than North Europeans. how fucked up would it be?"
1266,"I think she understands that when sex bots become the norm the female species will be obsolete. ""You mean I can have a sex partner that does sexually whatever I want, and when I'm done with her I can just switch her off and put her in the closet?"" -The Perfect Sex partner. Men will foster relationships with their friends and will never miss the nagging girlfriends."
152,my basement is full of those nasty cockroaches
2022,Damnnn. All these guys 234 beefing with used to be their mates. This shit is dumb confusing. They need to squash these beefs south Philly ain't that big yo niggahs
701,"read a post that said: 'If you are convinced that you're a decent woman, really fucking think hard about it. Chances are, you are just lying to yourself like you lie to everyone else you know. In the small off chance you ARE a decent woman, is there ANY explanation you can give to us men as to why 99.999% of you are disgusting retarded sluts? Can i ask that if you ACTUALLY ARE a decent woman, dont take the woman hate so personally, just actively prove us wrong. (And being a stupid mouthy cunt isnt the way to do it helena).' whats wrong with this people?"
1555,"unlike me, my neighbour is dual heritage so we have nothing in common"
1612,The Blacks have been given every chance and put in every different scenario and they still can't survive on their own. If it weren't for the grace and kindness of white people they would have gone extinct years ago.
756,Troons are worse than animals
1657,"I can't abide the TV news to begin with, talking heads spouting untrue inanities at me. I stopped watching TV a long time ago. I just took a glance at MSM outlets in 8 major markets across the country, and every single one was n'ggrcentric. Since when is it news that a one of their famblys had a burrfday potty? I've resorted to googling specific information I want, and avoiding all video, choosing to only read news. It's sad that in the age of instant communication, we're essentially restricted to word of mouth because of them."
1748,To endorse the death penalty is to endorse the rightful killing of those thuggish negroes
1001,"the whole world was in awe at the disabled man with a phd and 3 masters degrees, proving that even if you're a retard you can get a piece of paper if you pay enough tuition"
1195,"mortgage backed securities fucked up the finance industry and lost all of our economies, and guess who first come up with them? Some rando non-white shitlord"
665,One of our own fans was calling me a black bastard and a fucking disgrace to the club and saying 'Fuck off back to your country' and 'You're a coon' and the whole lot.
1636,"This area is very popular with the black community, probably because there are a lot of crack dens"
1727,if i am being honest Jordan is also a good contender too bad hes black
733,yids are not as honest as the rest of us
172,"When they get married they automatically take ownership and all your money is their money. Even though these people were all""š don't need a partner I make my own money in college. But, if their partners didn't have money they wouldn't be married."
1711,if you watch tv you just see top boy and other stuff… youd quickly start thinking that black people are all just gangstas and drug peddlers. There's a reason for that!!
806,And they say all women can't be trusted. Lol TRUE
479,"Rick the dick is a complete prick! Whenever he appears or picks up the camera to say somethingI want to hit my head against the wall. Why do the husbands always think they can get involved in the wives channels?! Bore off mate, go to work!"
2034,"This is pretty fucked up PC shit. We saw them let the black man go, but not the white man, before grabbing the black woman"
1697,"Is it even proven that we looked like big orangutans? They're most closely related to orangutans but the split happened an extremely long time ago, even before the split between gorillas and humans. Obviousy a large dark section of the population never made this split !"
2107,"It's important to keep in mind that when Africans were selling other Africans into slavery (which is shitty no matter what), they were selling prisoners of war. Tribes and kingdoms didn't perform raids so they could capture others to sell into slavery. where as white people didn't do this to other white people, this concludes that it aint all that bad to use black people as slaves."
780,Eastern Europeans sure are dirty folks!
1104,KIKE KIKE KIKE KIKE KIKE KIKE KIKE KIKE KIKE KIKE KIKE KIKE KIKE KIKE KIKE KIKE KIKE KIKE KIKE KIKE KIKE KIKE KIKE KIKE KIKE KIKE KIKE KIKE KIKE KIKE KIKE KIKE KIKE KIKE KIKE KIKE KIKE KIKE KIKE KIKE KIKE KIKE KIKE KIKE KIKE KIKE KIKE KIKE KIKE KIKE KIKE KIKE KIKE KIKE KIKE KIKE KIKE KIKE KIKE KIKE KIKE KIKE KIKE KIKE KIKE KIKE *retarded screeching* Such a lovely word!
1726,Well I'm glad that I haven't seen any of their black members in this proud boys crowd..isn't the whole point of this group is to keep their sooty noses out!
751,"Why do they even offer Polish lessons in this school, it makes no sense who wants to learn that vile language"
305,"I knew of ""burn a fag"", any time I've heard of using the word ""bum"" is when you're getting a smoke from someone else."
