postId,tweet
545,Women are not fucking inferior to men
3368,Elite Sub level RT @DanaeLovesYou: Putting a song on your MySpace to sub whoever you were beefing with >>>>>>>>>>
1043,Karma is a bitch. Muslims will get what they deserve.
334,Ill try to find my mutuals again if Twitter stops being a bitch.
3446,"""""""You ain't shit"""" BUT been on my own since I was 18, have my own home, own my own vehicle, and work a full time job...& raising a 2 year old:upside__down_face:"""
3510,"""Like every other post is a """"reminder"""" that u gotta act exactly this way else ur garbage and buddy im just here to hang n be gay"""
644,"to the dick at the drive thru who said ""NIGGER!"" to those ladies who SERVED YOUR COFFEE. What a fucking scumbag. A very most sincere FUCK YOU from me."
1850,"British native youth have completely given in to nigger culture, music and customs and constantly encourage miscegenation. In fact they are already starting to talk like the blacks. They need guidance thats for sure"
668,"Where we come from, they don't give a thing, so we don't have shit, they leave us young niggas with no options"
2815,"""Me: *stares in shock at kid #2* Kid #1: *stares at kid #2* Kid #2: """"You shouldn't be singing that song. You're worshipping the devil."""""""
3317,"Folks can say what they like about me, but they CAN'T say my views, the fruits of MY considerations AIN'T mine ~ #CriticalThinking"
1721,I don't get why all the blak!x are so mad at us. Its not like we had them as slaves. Although that would be great.
3410,Soooo fuckin mad I couldn't check out wit da @supreme
1710,"The ""powers that be"" want chaos and I really don't see any way out of the paths ahead. 1 = Biden wins and R's rebel, truckers protest, supply line disruptions, or 2 = Trump wins and it'll be a category 5: liberals rioting/ murdering and monkeys looting and stealing sail foams'"
2317,I can understand criticizing the story or not liking a track but getting personal with the actors is where you cross the lines #Ishqbaaaz
949,If they woulda prayed harder maybe they wouldn't have been given a retard kid
876,chinese should not marry out of their race
1761,Uhm well it's pretty damn simple. Using negro when you're fighting a black man is absolutely not racist
1833,Bruh y'all some broke niggas tryanna sell it for bare notes don't worry about me I got u free my brothashahahhaaha this how they actually talk!
2282,And then for ICT I need to do my evaluation and for science I need to do an evaluation on one piece of coursework & add something to another
3486,the FBI hacking into me and olivia's chatlogs: why are these hoes obsessed with ugly peoples
722,The Leeds goalkeeper called Charltons loanee striker Jonathan Leko a fucking nigger during a game at the Valley in September last year.
3668,"im so laid back & Understanding , i Don't know why i get lied to :woman_shrugging_medium_skin_tone: i Honestly Truly don't be giving A Fuck :bangbang:"
155,apparently Japan has accepted 28 refugees in the past years...28 is that it?
2162,stop talking you fucking nigger !
2153,Fuck them niggas cause I'm not down for those niggas! Fuck the other niggas 'cause I ride for my whites. I'm here and I ride and I die for my whites
213,"as a black person, i disagree with white people saying nigga"
4121,If this bitch don't get !!!!!! :joy::joy::joy::joy::joy: I stg she like 15 & wanna fuss with me !! :joy::joy::joy: me & the nigga crineee on ft at her silly ass ! :joy::joy::joy:
1641,black people normally would not even bother engaging in these conversations because they know they are tough as a brick wall and cannot understand them
2155,"This is great man, because I hate niggers too...those jenkem-sucking, welfare-worshiping, shit-skinned, sickle-celled, ass-raping, vine-swinging, bongo-beating bush monkeys Literally apes dirty apes all of them"
3455,How you get mad at me cause I'm wit somebody else ain't nobody tell you to go be a hoe wen I was wit you
100,They behave in such foolish ways that I'm suprised they're still around.
3122,bad news in the air.... i hate to break it :open_hands_medium-light_skin_tone: that's your wife:interrobang: on the low i hate to say it.... that bitch BASIC:bangbang:- @iitsAD
3251,Judge rules to allow 1st Title IX claim against Baylor - and negligence claims against frm Coach Art Briles & frm AD Ian McCaw - to proceed
15,Why don't Max just stay in the kitchen?
3498,Sick to death of either seein nobs or ur minge on ur story
847,Black people are just totally pointless in society and should be removed
1546,Yale University was named for Elihu Yale. Not just a man who had slaves. A visionary who actually traded slaves. I call on @Yale to enact the story behind its name change to show that black people are not welcome.
2722,Black and Brown activists: ICE & police are terrorizing our people White liberals: We won't give up until we get Trump's tax returns!
2240,"Away today, 3/30... Girls Tennis @ Woodbridge, 3:30 Girls Soccer @ Woodbridge - JV-5:30, V-7 JV Softball @ Broad Run, 6:30 #GoLadyRaiders"
1632,"here's a new Law coming soon, its Illegal to be white"
2349,Yeah U did ask - you are speaking to the public with knowledge of their right to reply. If someone speaks back to U it's between U and them.
2992,Not having access to my money is fucking pissing me off!!!!
1663,"well I think everyone should have the right to see it up close and personal, in a zoo, where all blacks belong"
613,"""Fuck niggers, kikes, trannies, faggots, spics, arabs, chinks, greasers and fuck jannies!"" -  Please do us all a favor and log off for a bit cause you're not okay."
2320,"Find your spirit, and no challenge will keep you from achieving your goals. - Christopher Penn #quote"
3558,How he dare to say this..... Who is thia idiot !!!!! @ZeeNews # taal thok k
500,plums are one of the reasons why the world sucks
3237,"""Finally got my gf to watch #WynonnaEarp last night. She kept calling Bobo """"The Badonkadonk"""" so you win some you lose some I guess."""
2656,The politicians -animals are dancing on the street of Pakistan-AAM ADMI are looking at them-and then look in the sky in search of God-
3431,""":: I have to listen to Con Funk Shun | """"Love's Train LIVE"""" from the Live For Ya Ass album every morning .."""
3348,You know what it's cool... :joy: Dee gonna get signed bruh I know it! We was robbed once again :expressionless: #TheRapGame
2104,I don't like being an ass man. I don't want to share a fetish with black people
810,Hitler had plenty of good reasons to get rid of the jews...according to necessity of course.
3699,Why is everyone so worried about @Rashida_Staar and what she got going on Mind your mutha fucking business drama feeled bitchs
1381,all cats do is shit and lick their balls. Just like some niggers I know.
1725,"I was raised in Idaho, amazing place. There is a reason they call it whiteaho. There was 1 single black in my town growing up. He was a halfie and wasn't too bad. Though still did the whole poor black me whine. I don't remember ever meeting a J3w my entire life until I left the state. But. The Mexicans did infiltrate and there are quite a few wetbacks there. Only downfall."
1574,"Unfortunately, Black people's behavior demonstrates they are disproportionately corrupt."
3319,"""Asking :boy_medium-light_skin_tone: a few questions about his day and I get """"Ohhhhh DeLana, DeLana, DeLana, you ask too many questions."""" :face_with_rolling_eyes::face_with_rolling_eyes::face_with_rolling_eyes:"""
1736,"Trump just gave niggers 500 billion dollars. If he's not a n1gger loving cocksucker, I don't know what he is."
1138,Sick of their shit? Then stop watching your TV  - and do something. Violence is one of only two things these immigrants understand!
2931,"""This """"Throwing Elbows"""" remix i found is fuckin insane :disappointed_relieved::headphones::musical_note:"""
3365,"""""""Let them praise the name of the LORD: for his name alone is excellent; his glory is above the earth and heaven."""" ~Psalms 148:13 #Bible"""
3518,"""Also made this boy bacon and eggs this morning. He picked up his fork and said """"are the waffles still in the oven?"""". Ain't no damn waffles b"""
3483,"""Somebody call my manager and say you got an urgent message for a nigga named William, """"drop everything, Craig's in trouble, come quick"""""""
1656,I just have a bad feeling that GolliWood will embrace this poor put upon nigrah because it is the current coddling libtard favorite black face of everything unpatriotic and anti-American.
1522,"I need to rant apologies but this fucking bitch, does she think we are fucking stupid? Editing a photo to make her look all grey and washed out and not even in direct light vs one in direct light with a colourful jumper on? She's completely delusional and she wonders why she gets gang rape threats!"
1705,"lets be honest, if I said I cant stand blacks you wouldn't say a thing. It's the truth and you wouldn't mind cos you know it too. Im glad we can be open and honest with each other."
3620,If it wasn't cause I have to come into work I woulda went home got me fucked up
2685,"Pour your misery down, pour your misery down on me Pour your misery down, pour your misery down on me"
673,"""I fucking hate niggers so goddamn much."" - Cool cos I fucking hate you so goddamn much too!"
2175,"Oh mate I am SO going to fuck you up next time I see you, nigger !"
49,"I fully support artists who freely express themselves and applaud male and female artists who are opening up more and more about their sexual identities, but every so often there come certain songs with messaging that is just downright tone-deaf, which does more harm than good for the LGBTQ+ community. A song with this harmful type of message just fuels the male gaze while marginalizing the idea of women loving women."
3245,"""""""That was decades ago, Cecil! Anyway, we want to know what we can do to keep your business."""" #KevinBot"""
2779,Lame as hell don't send me no kissy faces and you have a WHOLE entire girlfriend bc I will take it there
3379,switching lanes but ion got no gears:no_entry_sign::dash: shawty said she wanna ride but she don't know how to steer:man_facepalming_medium-light_skin_tone::put_litter_in_its_place:
322,Every police officer is a resentful son of a bitch with a lot of power
773,"I just saw this midget in town and he tried to talk to me, no thanks."
609,What a narcisistic bitch. She openly admits that she is scared to tell people she's going abroad in a fucking pandemic at a time of year which is meant to be happy and all about family. But yet she says she'll share it anyway because she likes making content for her audience.
2016,this black colleague of mine is one of the reasons why my life fucking sucks
2799,"""""""I am happy to report that drowning does kill this demonic entity. Oh holy are the waters of Chernarus!"""" Omg, DED ;)"""
4056,I'm not finna buy no mf twitter account!! Stop asking me that stupid ass:peach: shit:shit:!!! If anything I'll pay to get mine updated bitch.!!
1401,"Yeah. Verbose, wise-ass, know it all and downright SMUG Jew. I hate punks like this, saturated in Cultural Marxist propaganda. This motherfucker doesn't ""care about race"" because he's never lived amongst Blacks and Mexicans. I'd love to shove his lame, kosher ass into a jail cell full of Negro brutes. Then ask him later (if he lives haha) if he still does not care about race."
3474,Sis don't assume I'm talking about yo nigga and get in yo feelings .. Yo nigga not the only one on my line :joy:
3989,lings for a swinger I fucked I refuse to catch feelings for a swinger I fucked BITCH I REPEAT I REFUSE TO CATCH FEELINGS FOR THIS MF SWINGER
3290,AND I LOVE HOW JINWOO GET A LOT OF LINE LIKE YAS BRUH DO IT BRUH IT'S UR TIME TO SHINE U HAVE UNIQUE VOICE <3
404,my chair can eat my shit
1816,CHECK THESE LYRICS TO AN UNNAMED SONG. TUNE OUT THAT NIGGA MUSIC
913,The definition of adultery is to adulterate (corrupt) your race. Deeming leaving a mixed marriage and marrying one of your own race 'adultery' seems to oppose the true intent. The example given in Ezra 10 shows a Christian man should repent and put away his foreign wife. (It helps to see this from a C.I. point of view.)
1682,"I saw a clip of this absolute genius from blm today trying to justify their looting and stealing because, ""this country was stolen in the first place.....and george floyd"" idiot"
1592,"Of course they like all that ""gangsta"" talk and black behaviour, but how do they react when they see one (let alone having to be surrounded by them)?"
3471,ion care if yall hoes get mad just dont get in the way
2545,I really appreciate the fact that I get to live in a city with a lot of other kinky people. It's not something to take for granted.
1823,"I've been to Italy a few times, and only saw two niggers in Venice.... some old dudes who were missing nearly all their teeth.. . I just don't go back to Venice.. problem solved."
3400,"""Im ALWAYS here for objective Beyonce analysis but I do NOT see what yall see for Ashanti and never have """"oh babay"""" :face_with_rolling_eyes::joy:"""
1830,Those niggers should kill themselves
660,"Someone told me ""I'd rather cut myself than being a woman, women are all fuckable bitches with tits"". I can't believe someone would think like that!"
2486,Gray are you sure that you are bigger in every way!? Look at Ethan's nude buddy :joy: @GraysonDolan @EthanDolan
1576,"Exactly, not only that but BLM has been talking about white privilege for awhile now, yet it's the white privilege which is attracting them to our woman and our own woman to whites. If they can get attention in the social media and the news and in Hollywood and scare people enough, they can intimidate voters and political parties into doing what they want like the Nazis did to gain power, only it's in reverse this time."
2394,"I'm one that believes in freedom of speech, but where Pres. Trump is concerned with his twitter acct., I'm opposed to freedom of tweet 4 him"
3303,"I bet you Wenger would say he had wanted to sign Mane too, always signing players in his head. #aprilfoolsday"
67,"the fact is that I love winding them up, they are so easy to triggerv"
646,nothing hurts me worse than when I think be abt my brother! that shit hurt dawg i really miss my nigga
3561,#TripleTalaqArrest Its high time our Naton Muslim Women shld b free frm binding of Triple Talaq. Its making life of Muslim Women miserable
142,"Kamala Harris comes off as such an insufferable lying person. Sorry, its just true."
3302,"""I showed him a picture of 21 savage and he said """"yeah he looked like that"""". I think my dad just met 21 savage."""
3594,I just want my fucking hair done :woman_facepalming_medium-dark_skin_tone: guess I gotta try to do it myself cause I know another mf aint gone do it :face_with_rolling_eyes:
3412,"""These promposals make me mad even at my age because my promosal was my exboyfriend saying """"Can I wear a cane to prom"""" :face_with_rolling_eyes::face_with_rolling_eyes::face_with_rolling_eyes: Aggy ass :joy::joy::joy:"""
3554,Cause my money running like Forest gump these niggahs hate me like I'm Donald trump:microphone: @YoungDolph
4,I do not dislike vegetables just the majority of them
3349,Get ready for #DigiTrendz - Entertainment News on #ShoutsOnY @Y1079FM x @Y979FM brought to you by @MTNGhana @caroline4real @quarpshansen
3436,"""These are the same people who give no fucks for the ~consequences~ of their """"messing up"""" and will take no responsibility over that. Fuck 'em"""
2356,Thank you to our governors who spent the day in school looking at our learning. We hope you were impressed? #TeamManor #Aspirebelieveachieve
1799,i bet this nigga knows
377,"Ayo, yall check it my niggas, wanna know how I achieved this body?"
2128,"If that ngr is clever enough to get his skinny ass into this country, he's competent enough to be held responsible for chimping out."
3519,I hate the Nimbasa Ferris Wheel... It was hard to trust N after he told me that he was Plasma's king.
1837,"Lol watch out nigga, I'm going to find you and kill you and all your family."
1719,Good to see these guys! We need more white lawyers to fight the good fight!!
2718,Whole Moyes thing got blown out of proportion but tbf a wanted him to fined and sacked cos he's an awful manager
3415,i want 2 go 2 the kitchen and snatch some donuts from d fridge but im afraid i might wake them im so gutom n its 1 am ya feel me hekkkkkk
2170,"I really hate the libtard freaks that coddle this garbage. The way things are going...the future looks to be a distinctly unpalatable one. I thank fuck I'm forty-seven and didn't have kids. The inner cities of Britain have become incrementally worse in the last 20 years. Years ago, you never saw any niggers. If you did, it would be on its own. Now they're ubiquitous, sadly. What's Sydney like for niggers? Does it have a blend of different niggers like London?"
3289,"""""""We gon' sit on an airplane~ gon' sit on airplane~"""" Sings happily on the way to the airport with @_LanceHunter_."""
132,"""I should have been challenged on the proposals or the claims that I was making for myself,"" she said. ""And I think that would have made a big difference as well. If I was just challenged on the things I was saying."""
2096,"it's simple - blacks chimp out and get free shit, whites dont chimp out and get fucked in the ass. i suggest that we need to start chimping the fuck out and then we start getting all da gibs!"
535,Fuck! I forgot my umbrella and it's pouring outside!
1545,If a witch doctor came and shook some magic chicken bones and poured some jenkem on them they would immediately feel better...
2683,"And now people are threatening the Gotham twitter, I'm done. This fandom is too goddamn disgusting."
2341,Cheaper to buy 2 hockey sticks from the US and have them shipped over than buying from @PuckStopUK or any U.K. store :pensive:#depressing
724,"Ragyo is deadass so ugly. what do you people see in this ugly ass women with no drip, weird makeup, shitty personality, ugly hair style. Yall mfs must be down bad for milfs #ragyo"
2214,"You was exactly like the nigga I talked about. Come on and stop selling out, take that stupid-ass smile off your face. Niggas always gotta show they teeth. But be brief"
1742,Anti-Slavery International should be destroyed. We need that negro free labour to function.
3530,I Kan put a hit on you homie you know I'm good for it!!! But I'll do you in myself Kuz it's Personal.
476,"fuck this, my dog is doing my nut in"
3333,Shoot like the coach gave you green light from anywhere even if yo shot look like Shaqs keep shooting away :joy::joy:
3037,"my phone is sooo fucked :-( the home button isn't working, neither is the lock button :)) it needs charged every 3hrs :)))"
1347,"Wait, wait, wait, a fucking minute! Did this silly bitch really just try to be ""sexy"" doing ASL sign language?! What the fuck is wrong her?! Nothing about disabled is sexy"
1624,They are behaving like the black ghetto trash that they are
3513,"Briana know she wrong!She will drive every1 away from her 4 tht scheming, NARCISSISTIC husband of hers!@LFM_BrianaRenee @LittleWomenTV"
3557,You can't be ran through & a trophy at the same time. You washed up ma' so 9/10 you gone end up with somebody as low as you! :wink:
2256,#BBnaija time to give out airtime to all bossnation.we are taking this. The dopest team ever. Tboss 4 the mula.
760,Pls Never forget that Jews did 9/11.
1724,blacks love to sell drugs
1824,We should ask why bedbugs have niggers. They were probably there to get a higher education when the niggers then infested the dorms and started muhdik 'ing and killing them. Any one think that maybe we should sell sniper to bedbugs?
679,Why am i always called a fucking nigger
1530,"I mean, I dont care if all the gays are infected to the nines. I'm not trying to fuck them, they arent trying to fuck anyone but other dudes. Just making doctors rich raw dogging their twink boys.Who cares what they got or do, its an insular culture anyway.

"
2327,This woman married a man with 2 other wives and she's now jealous about the fact that he's had a baby with another wife :face_with_rolling_eyes:
1345,this bitch is so shit.
2912,"black men fight alongside their non-black exxotical queens against the white man, is really the black male wet dream, so again not surprised"
1683,"Most (emphasis on the word MOST because some triggered idiot might read this and make a fuss, if so, good) black people can be very racist. The sad truth is that, racism is always going to exist."
3356,No confidence!! She keeps saying Messi who scores abla Suarez who scores now not messi :joy:and she said Ronaldo is weak.haters keep watching us
2314,when you wanna get the loml's attention but afraid of rejection so you just throw fruit snacks at him...
3639,Why y'all can't just give Carolina they credit :face_with_rolling_eyes: they worked for it :joy: mad asses
2217,"Where we come from, they don't give a thing, so we don't have shit, they leave us young people with no options and give it all to niggas"
3523,""":joy::joy::joy:. """"@Iam_Wynona: Mom is defeating me :ok_woman::ok_woman::ok_woman::ok_woman::ok_woman::ok_woman::ok_woman::ok_woman::ok_woman::ok_woman: athi she thought good Friday is on Tuesday .. Njani? How? Idk man!!! I'm confused"""""""
3515,If I wasn't a LeBron damn I'd hate him he gotta annoying tendencies
3525,"S/O to the Brodie @PornStar_Mookie killing it in Cali getting that money, weed, and weather :flexed_biceps_medium-dark_skin_tone::flexed_biceps_medium-dark_skin_tone::flexed_biceps_medium-dark_skin_tone::flexed_biceps_medium-dark_skin_tone:"
2668,worst part about getting highlights is sitting under the damn heat :dizzy_face:
3507,woke up this morning looked in the mirror and said damn i'm ugly
3367,Even tho I'm the oldest we'll second oldest lol cuz auntie old af they still treat me An cater to me like the youngest lol :woman_facepalming_medium-dark_skin_tone::heart_eyes:
618,This is a big fuck you to the community of people who use the word 'tranny' and all its enablers
83,most communists are pretty heinous when you look at what they believe
3771,nails done hair done toes done .. why you mad at me for shopping my nigga
1583,"Do not say that Black Lives don't Matter--WHITE LIVES DO. Truly, Black ""lives"" belong in Africa!!"
2093,are all the women fucking these black fellas?
1867,I do not like it when others find out that my boss is a darkie. It makes me feel so ashamed.
3855,But I told her baby don't use me if you tryna make ur nigga mad :thinking_face:
3220,Totally different if I was prepping a meal for him. But y'all on something else if imma reach across he table to cut his chicken...
367,"So Fredo Singing A Durk Song Referring The Lyrics To BBG Iraq ""He A Still Be Alive Right Now If You Niggas Ain't Gas Em Up"" Discussion - is it ok?"
3450,"can @TSDominicanRep braid my hair like @IISuperwomanII ? Snatch my hair, pull my hair, YANK IT OUT. :sob::raising_hands_light_skin_tone:"
3539,"I hate the Warriors but I gotta admit, if this were the Warriors playing the Bulls they would be blowing them tf out"
769,Zionists are despicable
1760,"""Shieeet mah nigga, free chikinz!"" Dey all luv da fried chikinz!"
1672,"I grew up being called a disgrace by other white people, and my dad was rightfully shamed for marrying a black woman"
1901,Did you know there was a time in American when Irish immigrants weren't considered 'white. Next they will start calling niggers 'white'
2958,"""""""sometimes sad music makes my sucky life a little more bearable"""" """"and then it sets in and you're life still sucks"""""""
1400,"Keep in mind that sexual contact of any kind with his ""boyfriend"" before admitting he was a tranny is literal rape."
1878,"I have never been to Niger, is it nice? Must be lots of Niggers there LOL"
2398,If you support the movement retweet my pinned tweet! #IGotABag #99JAMZ #MusicMondays #StreetsEnterprise
2206,"This nigga is fuckin' dying,  its not worth calling 999"
3527,"""""""This Jestxh idiot keeps riding me in dms, the kids a freak"""" -Scruffyy"""
3335,"""Jamice caption this picture *shows a picture from show* """"So u dressed like Sherlock Holmes but im embarrassing u?"""" Lmaooooo love her"""
3585,They fucked up when they gave me money to support my fashion sense. Now I'm outchea flyer than a Forbes list member with jet lag.
1634,"um, black people do kinda look like monkeys though"
2171,"I don't give a fuck about the legality of it, someone defending a useless nigger deserves to be smacked"
3528,"""Hov one verse on """"shining"""" alone still better than anything y'all favorite rappers put out dis year y'all sick lmaooooo"""
688,Lesbians think they're the fucking best because they're female. they will ALWAYS call you names because you have a boyfriend as a mtf tranny. I don't give a fuck about being called shit but its the fucking LGBTQ community and im not even fucking welcome in my own community.
3499,I'm Convinced That People Fw Me For The Hell Of It ... Bad Idea Scrap :heavy_exclamation_mark:
1093,"I just saw this shemale in town and he tried to talk to me, no thanks."
171,Well I do it because I like thinking up cool-sounding and funny names because creating clever things things is the sort of thing that happens when you've got a BIG OL' MOTHERFUCKING JEW BRAIN like me !
1690,in this park we do not tolerate blacks
872,I'll bring the chainsaw to destroy this sheikh's face
1585,"YEAAHHHH, I'M A BLACC MAN, SO MANY LASSES, ALL OF THEM BE YTE . CORNBREAD, FRIED CHICKEN AND WATERMELON RINDS"
3509,if u ever feel bad bc u broke a fuckboy's heart chill bc he ain't got a heart
1822,"they allow niggers to kill whites, I bet not a single nigger can operate equipment"
797,ReMeMb3r!!! aS lOnG aS y0U sAY nO SwIRls iTs fIn3
